{
  "date": "2026-10-30",
  "announcement_date": "2026-10-30",
  "scope_note": "内部审计：2026-10-30 07:36:56 UTC 复核，六类官方 new 页均已显示 Friday, 30 October 2026。各类总数/新文/交叉/替换分别为 {\"cs.CV\": [374, 197, 36, 141], \"cs.RO\": [189, 109, 20, 60], \"cs.LG\": [608, 213, 159, 236], \"cs.AI\": [605, 158, 234, 213], \"cs.CL\": [279, 108, 67, 104], \"eess.IV\": [23, 8, 7, 8]}；这些是页面计数，含跨类重复，不是逐篇完整审阅数。API 此前代理 403，未重试，成功 API 类别数为 0；执行环境直接 HTML 下载也遭代理 403，已停止该路径。采用获准官方 web 公告及固定版本 abs/HTML 正文回退，关键词检索和定向选读并非穷尽筛选；未保存完整 Atom 或原始 HTML，不宣称采满 900 条。以复核时刻计算 16 小时起点 2026-10-29 15:36:56 UTC，当前最终选读候选仅 5 篇在窗内，故放宽至 36 小时起点 2026-10-28 19:36:56 UTC，12 篇均在窗内且属于今日公告新文。计数仅针对已核候选，不是全库窗口统计。与既有 24 篇 canonical ID 去重无重复。所有条目标 partial_text、未复现。固定版本及首次 UTC 时间：2610.40373v1 2026-10-29T16:21:06Z; 2610.39543v1 2026-10-29T07:44:54Z; 2610.39278v1 2026-10-29T03:30:27Z; 2610.40607v1 2026-10-29T17:53:02Z; 2610.40339v1 2026-10-29T16:03:19Z; 2610.40640v1 2026-10-29T17:58:45Z; 2610.39609v1 2026-10-29T08:43:08Z; 2610.40115v1 2026-10-29T14:14:16Z; 2610.40614v1 2026-10-29T17:54:42Z; 2610.39812v1 2026-10-29T10:54:32Z; 2610.39721v1 2026-10-29T09:51:26Z; 2610.39232v1 2026-10-29T02:50:17Z。",
  "papers": [
    {
      "arxiv_id": "2610.40373v1",
      "title": "HiFOR: Hierarchical Foresight with Action-Guided World Grounding for Vision-Language-Action Model",
      "authors": [
        "Rongxing Ding",
        "Hongyu Qu",
        "Kehong Wu",
        "Xudong Wang",
        "Fan Zhang",
        "Xinguang Xiang",
        "Xiangbo Shu"
      ],
      "published": "2026-10-29",
      "tags": [
        "vla-world-model"
      ],
      "score": 9,
      "score_reason": "相关性 5/5，证据 2/3，创新可用性 2/2：分层未来确实进入动作生成，有逐项消融；不等同于在线搜索。",
      "reading_depth": "partial_text",
      "motivation": [
        "预测下一刻画面与理解任务最终目标并不是同一件事；把所有预测一起交给动作模型，也未必能让它取到当前真正需要的信息。"
      ],
      "summary": [
        "HiFOR 同时预测短期、语义里程碑和目标层面的未来特征，并让动作去噪过程按时间层级、视角和空间位置检索它们。未来表征参与部署时的动作生成。"
      ],
      "insight": [
        "§3 的输入是多视角图像、指令和机器人状态，输出包含末端平移、旋转与夹爪的动作块。成功示范提供里程碑定位，冻结 DINOv2 提供未来视觉监督；短期还预测机器人状态。训练把动作 flow matching 与未来预测损失相加，检索结果通过残差进入动作专家。",
        "表 3 的 RoboTwin Hard 消融从无模块的 40.35% 到短期预测 44.15%，再加里程碑与目标达 46.95%，加入动作引导检索后为 49.40%。这是有用的递进对照，但评测为随机选取的 20 个任务，不能当成完整任务集成绩；检索预测特征也不是逐条模拟候选动作并搜索最优轨迹。"
      ],
      "connection": [
        "我的解读是，预测模块的价值取决于控制器如何读取它。进一步值得比较：固定读取与随去噪变化的读取在错误预测下谁更稳健；也可打乱时间层级，检查增益来自结构还是仅仅增加特征容量。这些是研究建议。"
      ],
      "limitations": [
        "本文选读 §3–4 与表 3，未复现。里程碑标注依赖示范、自动定位与人工复核；局部消融不能证明预测具备长期因果正确性，也没有相机回访或永久对象记忆证据。"
      ]
    },
    {
      "arxiv_id": "2610.39543v1",
      "title": "From Reasoning to Action: Consequence-Grounded Alignment for Vision-Language-Action Models",
      "authors": [
        "Yixue Zhang",
        "Wenke Xia",
        "Kun Wu",
        "Wenbo Yu",
        "Pei Ren",
        "Junnan Nie",
        "Di Hu",
        "Zhengping Che",
        "Chang Liu"
      ],
      "published": "2026-10-29",
      "tags": [
        "vla-world-model",
        "unified-understanding-generation"
      ],
      "score": 9,
      "score_reason": "相关性 5/5，证据 2/3，创新可用性 2/2：动作后果监督与部署路径区分清楚，具有分项对照。",
      "reading_depth": "partial_text",
      "motivation": [
        "机器人说出正确的动作意图，不代表实际动作会遵循它。需要同时检查动作方向是否匹配意图，以及动作产生的后果是否抵达预期位置。"
      ],
      "summary": [
        "CoRAct 先联合学习结构化推理、动作和动作条件未来图像，再冻结主模型，用运动一致性与视觉落点奖励训练动作初始噪声策略。部署只生成一份动作，不运行多候选未来验证。"
      ],
      "insight": [
        "§III 中，图像、状态和指令先生成 movement／waypoint 推理；推理用交叉熵，动作与未来图像用 flow matching。未来图像分支看动作而看不到推理中的目标落点，避免直接照抄答案。离线对候选未来图像定位夹爪，并与目标落点比较，按组相对奖励优化噪声分布。",
        "表 II 将推理和对齐逐步分开：VLABench 从无推理的 39.2%，经 movement／waypoint 监督达 47.5%，再加运动与后果对齐达 51.8%。§III-C 明确部署从学习到的分布采样一次，做 10 步动作去噪；因此闭环纠错来自后续观测，而不是每步在线想象搜索。"
      ],
      "connection": [
        "我的解读是，昂贵的后果检验可以变成训练信号，但收益仍取决于检验器是否可信。建议分别替换未来图像模型与落点定位器，测量哪一环误差会把噪声策略推向错误方向；动作意图一致也不能替代任务完成率。"
      ],
      "limitations": [
        "正文选读 §III–IV 与表 I–II，未复现。奖励依赖学习的未来图像及二维落点，并非真实执行后果；主要模型仍可能共享预测和验证偏差，不能据此宣称通用安全保证。"
      ]
    },
    {
      "arxiv_id": "2610.39278v1",
      "title": "WorldFlow: Joint Video and 3D Motion Prediction via Large-Scale Pretraining",
      "authors": [
        "Yuhao Lu",
        "Jiongxu Chen",
        "Hexiang Wei",
        "Jiajin Wu",
        "Juelin Li",
        "Mingjian Liang",
        "Fan Yang",
        "Zhuowei Liang",
        "Zihao Liu",
        "Zhennan Wang",
        "Sheng Wang",
        "Lin Shao"
      ],
      "published": "2026-10-29",
      "tags": [
        "vla-world-model",
        "video-world-model",
        "4d-object-centric"
      ],
      "score": 9,
      "score_reason": "相关性 5/5，证据 2/3，创新可用性 2/2：显式轨迹、匹配训练对照与小规模真机执行形成证据链。",
      "reading_depth": "partial_text",
      "motivation": [
        "像素里看得出物体将移动，不等于控制器能直接取得可执行的几何路径。先生成视频再跟踪，也会额外引入跟踪和尺度误差。"
      ],
      "summary": [
        "WorldFlow 从单帧图像、语言及三维查询点共同预测视频与点位移。它把对象运动作为独立生成模态，在共享注意力中与视频联合去噪，再把位移累积为轨迹。"
      ],
      "insight": [
        "§3 使用联合 rectified-flow 损失，并补充位移、累计方向和终点约束。查询点的初始几何与图像位置对齐视频 token。§4.3 的匹配骨干、数据和优化对照中，SpatialCog 的终点误差由仅预测 flow 的 0.248 米降到联合生成的 0.078 米，支持视频监督对运动预测的帮助。",
        "§4.4 真机确实使用预测：RGB-D 提取对象点云，预测轨迹再交给抓取与局部刚性拟合模块转成机械臂运动。保持其余模块一致的 36 次执行中，成功为 24/36，对照 μ₀ 为 4/36；这仍明显低于作者判定的轨迹预测成功 35/36，说明预测合理与完整执行之间还有落差。"
      ],
      "connection": [
        "我的解读是，应把“世界预测正确”“动作可实现”“任务完成”作为三项分别统计。进一步可按抓取、轨迹拟合与接触失败拆解错误，避免只提高离线轨迹指标却没有改善控制。这里的迁移接口是对象运动，不是一个已经端到端学好的通用策略。"
      ],
      "limitations": [
        "选读 §3–4 与表 2，未复现。三维监督含自动估计噪声，查询点需预先提供；真机每任务仅三次，不能外推广泛可靠性，也没有相机返回后的动态对象状态测试。"
      ]
    },
    {
      "arxiv_id": "2610.40607v1",
      "title": "Fight World Model: Customizable Combat through Visual Interaction Proxies",
      "authors": [
        "Jiahua Li",
        "Zixu John",
        "Tom Zhong",
        "Fuping Wu",
        "Tianhao Xu",
        "Ruicheng Zhang",
        "Jun Zhou",
        "Zunnan Xu"
      ],
      "published": "2026-10-29",
      "tags": [
        "video-world-model",
        "video-generation"
      ],
      "score": 9,
      "score_reason": "相关性 5/5，证据 2/3，创新可用性 2/2：规则干预和同记录编码对照具体，证据范围限于固定视角格斗。",
      "reading_depth": "partial_text",
      "motivation": [
        "受击动画、血量下降和攻击指令通常一起出现，但免疫或吸血规则会打破这种关联。能画出熟悉的打斗，未必能忠实执行修改后的规则。"
      ],
      "summary": [
        "FWM 由程序引擎更新状态，确定性编译器把攻击窗口、短暂受击与持续血量分别编码为视觉条件，视频模型只负责渲染这些已确定的结果。"
      ],
      "insight": [
        "§3 将角色身份同时绑定到参考图、初始画面和代理图；flow matching 仅监督未来视频 latent，条件保持干净。修改规则后重新运行引擎，参考与文字保持不变，从而检查渲染是否遵守新状态，而不是让文本直接提示结果。",
        "表 2 在相同执行记录下比较编码：空间代理加状态 token 的联合交互得分为 63.28%，完整交互代理为 98.48%。表 4 去掉血条后健康值 MAE 从 0.15 升到 2.18 个最大血量百分点。指标是规则结果的画面兑现程度，不是模型独立推断物理规律的准确率。"
      ],
      "connection": [
        "我的解读是，规则执行与视觉服从可以拆开测量。建议把同一规则放到不同外观、角色换边和长时间间隔中，单独检查状态正确但画面错误的情形。对对象持久性研究，这提供了可核对状态的实验思路，却不能替代三维遮挡与相机回访评测。"
      ],
      "limitations": [
        "选读 §3–4、表 2／4，未复现。实验是 Street Fighter II 固定二维视角；部分反应与外观判断依赖 VLM，跨系统输入接口也不完全相同，不能称为统一条件下的通用世界模型排名。"
      ]
    },
    {
      "arxiv_id": "2610.40339v1",
      "title": "Wizard: Manipulate Any World in Real Time via Agentic Control",
      "authors": [
        "Yuzhe Wu",
        "Zijun Lin",
        "Yeying Jin"
      ],
      "published": "2026-10-29",
      "tags": [
        "video-world-model",
        "video-generation"
      ],
      "score": 8,
      "score_reason": "相关性 5/5，证据 1/3，创新可用性 2/2：可操作的结构化控制方案，但主要实验是定性展示。",
      "reading_depth": "partial_text",
      "motivation": [
        "新角色、新场景和新动作要在同一生成系统里组合，单靠文字提示很难精确控制骨骼运动，更难保证游戏状态与画面始终对应。"
      ],
      "summary": [
        "Wizard 把角色骨架和场景几何编成代理视频，用显式状态控制器更新动作、碰撞和血量，再由视频生成器按照代理与参考图渲染。"
      ],
      "insight": [
        "§4 输入包括场景图、角色参考和玩家控制；先重建近似几何、绑定骨架并检索重定向动作。角色区域掩码限制参考图注意力，变身时阻断旧身份缓存；状态由控制器维护，战斗判定不依赖生成画面的“想象”。",
        "生成骨干经过因果适配、一致性蒸馏和自身 rollout 上的分布匹配蒸馏，报告两步去噪、24 FPS。§5 的新角色与场景结果主要是配对代理／生成帧的定性展示，没有足以支持普遍领先的量化对照。启动前还有场景与角色准备过程，实时帧率不能解释为从任意图片立即完成初始化。"
      ],
      "connection": [
        "我的解读是，把可编辑的骨架和几何暴露出来，是一种清楚的控制接口。下一步更值得测的是代理执行正确时渲染仍失败的比例，并把动作库覆盖、身份泄漏与新场景失真分开归因，而不是只展示几个看起来流畅的组合。"
      ],
      "limitations": [
        "选读 §3–5，未复现。近似几何和已有动作库构成限制；训练包含离开再出现情形，但这不等于完成严格 camera-return 基准，更不能证明任意动态对象的长期状态一致。"
      ]
    },
    {
      "arxiv_id": "2610.40640v1",
      "title": "SonoWorld4D: From One Video to a 4D Audio-Visual Scene via Diffusion Synchronization",
      "authors": [
        "Derong Jin",
        "Xiyi Chen",
        "Ming C. Lin",
        "Ruohan Gao"
      ],
      "published": "2026-10-29",
      "tags": [
        "4d-object-centric",
        "video-generation"
      ],
      "score": 8,
      "score_reason": "相关性 4/5，证据 2/3，创新可用性 2/2：对象中心声场与新监听位置验证具体，但不是动作条件控制模型。",
      "reading_depth": "partial_text",
      "motivation": [
        "换一个位置听到的声音，不该仍保留原相机处的远近变化。动态场景中的声音需要跟随对象，而不是永远贴在输入视频的观察位置。"
      ],
      "summary": [
        "SonoWorld4D 将单目视频拆成静态背景和动态对象的四维表示，再在对象空间与相机空间之间同步音频扩散，使声音能随新的监听轨迹重新渲染。"
      ],
      "insight": [
        "§4 先对前景轨迹与背景做尺度和局部位置对齐；音频采样中通过正向声学渲染、声源分离与近似逆变换约束两个空间。它是无需新增训练的组合框架，不是把动作输入进动力学模型来预测新事件。声学模型面向弱混响室外场景，忽略反射路径。",
        "SonoScene4D 的 54 段视频均为 8 秒，并在不同于相机的位置录制声音。表 1 完整方法的声源方向角误差为 40.7°，仅视频生音变体为 46.1°。这支持对象空间同步对新监听位置的帮助，但误差仍不小，不能说空间声音已经精确恢复。"
      ],
      "connection": [
        "我的解读是，对象身份和世界坐标也能为音频提供持续锚点。可以进一步设计对象暂时不可见但声音持续、或对象位置改变后的返回测试，分别检验几何定位与声源绑定；这些是建议，论文的自由视点渲染不能自动算作已经完成这些持久性实验。"
      ],
      "limitations": [
        "选读 §3–5 与表 1，未复现。前景重建、分离和近似逆声学过程都可能带入误差；场景来自输入片段，尚不是可持续执行任意动作的交互物理世界。"
      ]
    },
    {
      "arxiv_id": "2610.39609v1",
      "title": "DiFuse: Fusing Native Diffusion Representations for Spatial Reasoning in Unified Multimodal Models",
      "authors": [
        "Ruixin Fan",
        "Weining Wang",
        "Jiahui Sun",
        "Tailai Chen",
        "Jing Liu"
      ],
      "published": "2026-10-29",
      "tags": [
        "unified-understanding-generation"
      ],
      "score": 8,
      "score_reason": "相关性 4/5，证据 2/3，创新可用性 2/2：同数据 SFT 对照支持生成表征回流理解，但主要是静态空间问答。",
      "reading_depth": "partial_text",
      "motivation": [
        "统一模型能看图也能画图，不代表生成分支学到的结构已经被理解分支利用。关键是能否把空间信息按正确位置接回去。"
      ],
      "summary": [